id,customer_name,message
1,John Smith,"I've been charged twice this month and no one is helping me!!"
2,Sarah Johnson,"Hey just wondering how I change my email address on my account?"
3,Mike Davis,"Your app keeps crashing every time I try to upload a file. Very frustrating."
4,Emily Chen,"I want a refund for my subscription, I never agreed to auto-renewal"
5,Chris Wilson,"How do I cancel my account?"
6,Amanda Lee,"I can't log in, it keeps saying invalid password but I know it's correct"
7,David Brown,"This is the worst service I've ever used, nothing works!!"
8,Jessica Taylor,"Just wanted to say your new update is amazing, love the new features!"